{
  "$schema": "./backlog.schema.json",
  "version": 2,
  "project": "RASTA",
  "asOf": "2026-10-16",
  "governance": {
    "baselineState": "APPROVED",
    "approvedBy": "Product Owner",
    "pointScale": [1, 2, 3, 5, 8, 13, 21],
    "earnedStatus": "ACCEPTED",
    "cancelledStatus": "CANCELLED",
    "minimumClosedIterationsForForecast": 2
  },
  "iterations": [],
  "epics": [
    {
      "id": "EP-PLATFORM",
      "title": "Platform foundation and engineering",
      "scope": "MVP",
      "owner": "platform"
    },
    {
      "id": "EP-CORE",
      "title": "Identity, organization and core fleet",
      "scope": "MVP",
      "owner": "core-platform"
    },
    {
      "id": "EP-OPERATIONS",
      "title": "Maintenance and field operations",
      "scope": "MVP",
      "owner": "operations"
    },
    {
      "id": "EP-COMMERCE",
      "title": "Economic, marketplace and supply chain",
      "scope": "MVP",
      "owner": "commerce"
    },
    {
      "id": "EP-CONSTRUCTION",
      "title": "Construction and contracts",
      "scope": "MVP",
      "owner": "construction"
    },
    {
      "id": "EP-EXPERIENCE",
      "title": "Web, mobile and user experience",
      "scope": "MVP",
      "owner": "web"
    },
    {
      "id": "EP-OPERABILITY",
      "title": "Operability, hardening and pilot",
      "scope": "MVP",
      "owner": "platform"
    },
    {
      "id": "EP-INSURANCE",
      "title": "Commercial insurance",
      "scope": "POST_MVP",
      "owner": "insurance"
    },
    {
      "id": "EP-ENGAGEMENT",
      "title": "Participation, reward and ranking",
      "scope": "POST_MVP",
      "owner": "reward"
    },
    {
      "id": "EP-REVERSE",
      "title": "Reverse logistics",
      "scope": "POST_MVP",
      "owner": "inventory-and-logistics"
    },
    {
      "id": "EP-IOT",
      "title": "IoT and telematics",
      "scope": "POST_MVP",
      "owner": "iot-telematics"
    },
    {
      "id": "EP-EXPANSION",
      "title": "National-scale product expansion",
      "scope": "POST_MVP",
      "owner": "platform"
    }
  ],
  "items": [
    {
      "id": "PLAT-001",
      "epicId": "EP-PLATFORM",
      "title": "Monorepo and shared platform foundations",
      "scope": "MVP",
      "priority": "P0",
      "points": 13,
      "status": "ACCEPTED",
      "acceptanceCriteria": [
        "Strict TypeScript monorepo builds, lints and type-checks",
        "Shared contracts, configuration, logging and Nest infrastructure exist without shared business logic"
      ],
      "dependencies": [],
      "sourceRefs": ["docs/17-mvp-scope.md#۱۷۱-p0--demo-روز-۱۰"],
      "evidence": [
        {
          "kind": "CI",
          "ref": "https://github.com/marabi766/RASTA/actions/runs/33313483658",
          "note": "Main quality pipeline passed"
        }
      ]
    },
    {
      "id": "PLAT-002",
      "epicId": "EP-PLATFORM",
      "title": "Local runtime infrastructure",
      "scope": "MVP",
      "priority": "P0",
      "points": 13,
      "status": "ACCEPTED",
      "acceptanceCriteria": [
        "PostgreSQL, Redis, Kafka, Keycloak, MinIO and Temporal have reproducible local definitions",
        "Service databases are independently provisioned"
      ],
      "dependencies": ["PLAT-001"],
      "sourceRefs": ["docs/11-infrastructure-architecture.md"],
      "evidence": [
        {
          "kind": "DOCUMENT",
          "ref": "PROJECT_MEMORY.md",
          "note": "Runtime and live-verification evidence is recorded"
        }
      ]
    },
    {
      "id": "PLAT-003",
      "epicId": "EP-PLATFORM",
      "title": "Tenant isolation, authentication and authorization foundation",
      "scope": "MVP",
      "priority": "P0",
      "points": 13,
      "status": "ACCEPTED",
      "acceptanceCriteria": [
        "JWT validation and tenant context are enforced",
        "Positive and negative authorization and tenant-isolation paths are tested"
      ],
      "dependencies": ["PLAT-001"],
      "sourceRefs": ["AGENTS.md", "docs/09-security-architecture.md"],
      "evidence": [
        {
          "kind": "CI",
          "ref": "https://github.com/marabi766/RASTA/actions/runs/33313483658",
          "note": "Security and tenant-isolation gates passed"
        }
      ]
    },
    {
      "id": "PLAT-004",
      "epicId": "EP-PLATFORM",
      "title": "CI, security scans and container verification",
      "scope": "MVP",
      "priority": "P0",
      "points": 13,
      "status": "ACCEPTED",
      "acceptanceCriteria": [
        "Quality, security, integration and E2E jobs run on main",
        "Every current service image is built and scanned without Critical or High findings"
      ],
      "dependencies": ["PLAT-001"],
      "sourceRefs": [".github/workflows/ci.yml", "docs/14-testing-strategy.md"],
      "evidence": [
        {
          "kind": "CI",
          "ref": "https://github.com/marabi766/RASTA/actions/runs/33313483658",
          "note": "All main jobs and seven image scans passed"
        }
      ]
    },
    {
      "id": "PLAT-005",
      "epicId": "EP-PLATFORM",
      "title": "Formal backlog and Story Point progress control",
      "scope": "MVP",
      "priority": "P1",
      "points": 5,
      "status": "ACCEPTED",
      "acceptanceCriteria": [
        "A canonical validated backlog calculates MVP and full-product progress",
        "CI rejects invalid or stale progress data",
        "Governance prevents unverified work from earning points"
      ],
      "dependencies": ["PLAT-004"],
      "sourceRefs": ["docs/25-progress-governance.md"],
      "evidence": [
        {
          "kind": "CI",
          "ref": "https://github.com/marabi766/RASTA/actions/runs/33315693378",
          "note": "The backlog gate, progress tests, quality, security, integration, E2E and migration checks passed on PR #10"
        }
      ]
    },
    {
      "id": "CORE-001",
      "epicId": "EP-CORE",
      "title": "Identity service core",
      "scope": "MVP",
      "priority": "P0",
      "points": 13,
      "status": "ACCEPTED",
      "acceptanceCriteria": [
        "OIDC, membership, roles and active-organization flows meet the documented contracts",
        "Identity isolation, authorization and API paths are tested"
      ],
      "dependencies": ["PLAT-003"],
      "sourceRefs": ["docs/04-service-decomposition.md"],
      "evidence": [
        {
          "kind": "DOCUMENT",
          "ref": "PROJECT_MEMORY.md#۳-current-verified-state",
          "note": "Implemented, tested and live-verified state"
        }
      ]
    },
    {
      "id": "CORE-002",
      "epicId": "EP-CORE",
      "title": "Organization service core",
      "scope": "MVP",
      "priority": "P0",
      "points": 8,
      "status": "ACCEPTED",
      "acceptanceCriteria": [
        "Organization hierarchy and membership-facing contracts are implemented",
        "Tenant-scoped CRUD and subtree visibility are tested"
      ],
      "dependencies": ["CORE-001"],
      "sourceRefs": ["docs/04-service-decomposition.md"],
      "evidence": [
        {
          "kind": "DOCUMENT",
          "ref": "PROJECT_MEMORY.md#۳-current-verified-state",
          "note": "Implemented, tested and live-verified state"
        }
      ]
    },
    {
      "id": "CORE-003",
      "epicId": "EP-CORE",
      "title": "API gateway core",
      "scope": "MVP",
      "priority": "P0",
      "points": 8,
      "status": "ACCEPTED",
      "acceptanceCriteria": [
        "Authenticated routes proxy with correlation, tenant context and circuit breaking",
        "Unavailable upstreams fail with the platform error contract"
      ],
      "dependencies": ["CORE-001"],
      "sourceRefs": ["docs/06-api-architecture.md"],
      "evidence": [
        {
          "kind": "CI",
          "ref": "https://github.com/marabi766/RASTA/actions/runs/33313483658",
          "note": "Gateway unit and E2E paths passed"
        }
      ]
    },
    {
      "id": "CORE-004",
      "epicId": "EP-CORE",
      "title": "Asset service core and dossier",
      "scope": "MVP",
      "priority": "P0",
      "points": 13,
      "status": "ACCEPTED",
      "acceptanceCriteria": [
        "Assets have organization-agnostic identity and an explicit lifecycle",
        "The dossier projection is idempotently built from events"
      ],
      "dependencies": ["CORE-002"],
      "sourceRefs": ["docs/17-mvp-scope.md#دارایی-و-ناوگان"],
      "evidence": [
        {
          "kind": "DOCUMENT",
          "ref": "PROJECT_MEMORY.md#۳-current-verified-state",
          "note": "Asset lifecycle and event projection are verified"
        }
      ]
    },
    {
      "id": "CORE-005",
      "epicId": "EP-CORE",
      "title": "Fleet assignment, usage and availability core",
      "scope": "MVP",
      "priority": "P0",
      "points": 13,
      "status": "ACCEPTED",
      "acceptanceCriteria": [
        "Assignment exclusivity is enforced by the database",
        "Usage and availability flows are tenant-scoped and event-driven"
      ],
      "dependencies": ["CORE-004"],
      "sourceRefs": [
        "docs/adr/ADR-025-assignment-exclusivity.md",
        "docs/adr/ADR-026-fleet-asset-boundary.md"
      ],
      "evidence": [
        {
          "kind": "DOCUMENT",
          "ref": "PROJECT_MEMORY.md#۲-current-development-phase",
          "note": "Fleet code, tests and live E2E verification completed"
        }
      ]
    },
    {
      "id": "OPS-001",
      "epicId": "EP-OPERATIONS",
      "title": "Maintenance schedules, requests, repair orders and costs",
      "scope": "MVP",
      "priority": "P0",
      "points": 21,
      "status": "ACCEPTED",
      "acceptanceCriteria": [
        "Due state is derived from time and usage triggers",
        "Request and repair-order lifecycles, concurrency-safe costs and approval events are verified"
      ],
      "dependencies": ["CORE-004", "CORE-005"],
      "sourceRefs": [
        "docs/adr/ADR-027-maintenance-due-evaluation.md",